{
  "$schema": "../schemas/upstream-superpowers-lock.schema.json",
  "schema_version": 1,
  "generated_at": "2026-03-14T16:39:47Z",
  "upstream": {
    "repo": "https://github.com/obra/superpowers",
    "branch": "main",
    "pinned_commit": "363923f74aa9cd7b470c0aaa73dee629a8bfdc90"
  },
  "source_paths": [
    "skills/",
    "hooks/",
    "commands/",
    "agents/",
    "docs/"
  ],
  "workflows": [
    {
      "workflow": "pre-commit",
      "upstream_path": "skills",
      "local_contract": "docs/archived-workflows/pre-commit.md",
      "divergence": "extend",
      "owner": "@maintainers/standards",
      "adapters": {
        "claude_skill": ".claude/skills/pre-commit/SKILL.md",
        "opencode_command": ".opencode/commands/pre-commit.md",
        "cursor_rule": ".cursor/rules/engineering-standards.md",
        "copilot_instruction": ".github/instructions/micro-commit.instructions.md"
      }
    },
    {
      "workflow": "micro-commit",
      "upstream_path": "skills",
      "local_contract": "docs/archived-workflows/micro-commit.md",
      "divergence": "extend",
      "owner": "@maintainers/standards",
      "adapters": {
        "claude_skill": ".claude/skills/micro-commit/SKILL.md",
        "opencode_command": ".opencode/commands/micro-commit.md",
        "cursor_rule": ".cursor/rules/engineering-standards.md",
        "copilot_instruction": ".github/instructions/micro-commit.instructions.md"
      }
    },
    {
      "workflow": "tdd-enforcement",
      "upstream_path": "skills",
      "local_contract": "docs/archived-workflows/tdd-enforcement.md",
      "divergence": "extend",
      "owner": "@maintainers/standards",
      "adapters": {
        "claude_skill": ".claude/skills/tdd-enforcement/SKILL.md",
        "opencode_command": ".opencode/commands/tdd-enforcement.md",
        "cursor_rule": ".cursor/rules/engineering-standards.md",
        "copilot_instruction": ".github/instructions/micro-commit.instructions.md"
      }
    }
  ],
  "checksums": [
    {
      "path": "agents/code-reviewer.md",
      "sha256": "b17be291994b798cf34b74c5d0afcb9da92dd466453557933161cc4e7332029d"
    },
    {
      "path": "commands/brainstorm.md",
      "sha256": "9c8219cf19f34a002766132800666f196afc2ff09befa1afa5726426ee3ee6c8"
    },
    {
      "path": "commands/execute-plan.md",
      "sha256": "622568a30dc85e7f57a32d581bfad17ca138c141d8fd6a184b7d9e848abd4035"
    },
    {
      "path": "commands/write-plan.md",
      "sha256": "1a932a02e5115234fa83a4a248ea744d64ed4688fa0f74613f7400d97dcd82cc"
    },
    {
      "path": "docs/README.codex.md",
      "sha256": "098828bbe27d578237a8b5e951b047486ba7eeebff0945390c4899193dc81b4b"
    },
    {
      "path": "docs/README.opencode.md",
      "sha256": "4e3a1c8d9c063568b1f732832e3b24915346da55b2c565c1ad023cf1e26545cb"
    },
    {
      "path": "docs/plans/2025-11-22-opencode-support-design.md",
      "sha256": "4688cb2e4bafa7e6124dd811be57c8873bfb4b8cccb95ddbd7032557a9cfd10b"
    },
    {
      "path": "docs/plans/2025-11-22-opencode-support-implementation.md",
      "sha256": "2cc68cc29ee1174e13a65739b004f2346911a0d89a20744930f9f5b81963b4f3"
    },
    {
      "path": "docs/plans/2025-11-28-skills-improvements-from-user-feedback.md",
      "sha256": "cce0b2e951209ac7d555fcbacfc858d8069b4036019d44dd95bb4334afaf2e65"
    },
    {
      "path": "docs/plans/2026-01-17-visual-brainstorming.md",
      "sha256": "2ff9c06d8c7cf650becb588d74507c5681c55844c61e21160a290cbe26d41ca4"
    },
    {
      "path": "docs/superpowers/plans/2026-01-22-document-review-system.md",
      "sha256": "92875a4d7db7acef7737ace512ed5a6ae29ab76aff421633276a4a824c5d5cf7"
    },
    {
      "path": "docs/superpowers/plans/2026-02-19-visual-brainstorming-refactor.md",
      "sha256": "fbc67c4e7c5e42ff6e8e647951b749a2610ca2e13639903867258032c175bbbe"
    },
    {
      "path": "docs/superpowers/plans/2026-03-11-zero-dep-brainstorm-server.md",
      "sha256": "d1e3b19e1111cab0a113519a9d2d9e881080c5fe13c3227e6c22fa88d08dc11d"
    },
    {
      "path": "docs/superpowers/specs/2026-01-22-document-review-system-design.md",
      "sha256": "19dd839168b9e4a072985e8941aa3ae7cf9101357111620755d50dbeb1bea04b"
    },
    {
      "path": "docs/superpowers/specs/2026-02-19-visual-brainstorming-refactor-design.md",
      "sha256": "f27d0f9c33cc4f34101fd676d48e73d6259e6cd4e1b3adc477ea81f4c7557af7"
    },
    {
      "path": "docs/superpowers/specs/2026-03-11-zero-dep-brainstorm-server-design.md",
      "sha256": "8f29bac7d4df2b51062c005fe4d591140f1da3ab2030b28537df6f964637b9e9"
    },
    {
      "path": "docs/testing.md",
      "sha256": "04e45dd04d4238372f05ed3605df7af34b3c78e36758163353298e788021d51f"
    },
    {
      "path": "docs/windows/polyglot-hooks.md",
      "sha256": "6ab79f0a8fc90e61bd0723ba153630e75d883883f6b9a15d07025e341c18c565"
    },
    {
      "path": "hooks/hooks.json",
      "sha256": "ecb05b584aee11388d081e26510a535308740e0af7e5702f44fe017b8b994790"
    },
    {
      "path": "hooks/run-hook.cmd",
      "sha256": "d3d9c6199678dab2858e60509dde5e7414f13c2a2b5e48a38b1d368b6e1d6abb"
    },
    {
      "path": "hooks/session-start",
      "sha256": "c9a33760894c774a5904a64b8a1c96e527254bdd16bddfbf579e02d2c7f2f019"
    },
    {
      "path": "skills/brainstorming/SKILL.md",
      "sha256": "108ec2f11ec511b4438d9d4f7b3db88cbf9646d9706bd1008cb342d8d46e6241"
    },
    {
      "path": "skills/brainstorming/scripts/frame-template.html",
      "sha256": "fb22ba9d47f3b83b56e0a95d52a3c2727db03b0d4365078d92c850293a62457b"
    },
    {
      "path": "skills/brainstorming/scripts/helper.js",
      "sha256": "e763d82f32b4ebb320be2f0d08449d3e5a0585778edf5c407c1fdab3f39976a5"
    },
    {
      "path": "skills/brainstorming/scripts/server.js",
      "sha256": "220b62eecadb4b91d485e2ec609997a01495a5bb58454bca527a0b008bdd0968"
    },
    {
      "path": "skills/brainstorming/scripts/start-server.sh",
      "sha256": "d451a68ecff6c9158399f2f4836aa380c6e98a96a52ac679f7272683cd41d025"
    },
    {
      "path": "skills/brainstorming/scripts/stop-server.sh",
      "sha256": "6e9879a47ec50fdfbabd63611eefa093acda8033da9ecd23adedb38591ff9029"
    },
    {
      "path": "skills/brainstorming/spec-document-reviewer-prompt.md",
      "sha256": "c9a094a4c8f8b5a549db1cfd44c364e82b849e60cc9fc97ccb6068f78e28658e"
    },
    {
      "path": "skills/brainstorming/visual-companion.md",
      "sha256": "a6c01cefbf87f30e27b0b337397764cdd10f803a4188bbbedc9aa041762c27bf"
    },
    {
      "path": "skills/dispatching-parallel-agents/SKILL.md",
      "sha256": "76806091c7f923ba2596546b19cccd98a08e57a68745df77c3a7b998fe838e2b"
    },
    {
      "path": "skills/executing-plans/SKILL.md",
      "sha256": "a711f83fb762e2ea0fa151f598893da9911a408895c91cc7a7e0770dd59a27b3"
    },
    {
      "path": "skills/finishing-a-development-branch/SKILL.md",
      "sha256": "dd2f82c6dc8582b621f9eb57fcb65f557f88eadf872727ac81d0840ae12c504e"
    },
    {
      "path": "skills/receiving-code-review/SKILL.md",
      "sha256": "c9382e92b8f32363566068ecfed19d3b2651eaf40d3942b24840f839dedfc406"
    },
    {
      "path": "skills/requesting-code-review/SKILL.md",
      "sha256": "a5ff68586ccf62d1803cedeb71d60fd96ec05591d29c8d123196117eefd34cd0"
    },
    {
      "path": "skills/requesting-code-review/code-reviewer.md",
      "sha256": "7f5328dca12cb200005ae9d4386f63a9b0acb735ece57f82db206b4a3189ccae"
    },
    {
      "path": "skills/subagent-driven-development/SKILL.md",
      "sha256": "081ad3869e55c80bf8f890b4768a90c0e8057daf94b1b6fadebfc85ea5b8304a"
    },
    {
      "path": "skills/subagent-driven-development/code-quality-reviewer-prompt.md",
      "sha256": "06d1e7c2287e5a00bd1809bf39038abd5f413b4cf917c37d30f00c48f6293421"
    },
    {
      "path": "skills/subagent-driven-development/implementer-prompt.md",
      "sha256": "a416193f881e5a712c988fffabfe1d5a97bffcd091eb95577c84fe2136588617"
    },
    {
      "path": "skills/subagent-driven-development/spec-reviewer-prompt.md",
      "sha256": "631980e472eec5394de8b89b69d432e54fd3f7f523ecf9afa7eb4cda0c9b2baf"
    },
    {
      "path": "skills/systematic-debugging/CREATION-LOG.md",
      "sha256": "b482ef9a918fbfc6c369729e8160633ddfa2332466dd362ee73f1527c239ef8b"
    },
    {
      "path": "skills/systematic-debugging/SKILL.md",
      "sha256": "4999cb851360485eca5074e727bbdd62ef20549c5d5b01216fcbf5831badb473"
    },
    {
      "path": "skills/systematic-debugging/condition-based-waiting-example.ts",
      "sha256": "40ae5ebe497fdf310200e43fe986552546d0a22837c0d39e855db1cfd33eb88e"
    },
    {
      "path": "skills/systematic-debugging/condition-based-waiting.md",
      "sha256": "e89fec8400d6cd50f43407cec9fab50976ba4d55d0ec2eb51c0bd68036b54c26"
    },
    {
      "path": "skills/systematic-debugging/defense-in-depth.md",
      "sha256": "1e175fb86fc357e58c6aebf5441e481e1b7868b4380c0456b63a17eefbd18ba7"
    },
    {
      "path": "skills/systematic-debugging/find-polluter.sh",
      "sha256": "6462747eae9b175ac145b78bcfaeab755654a75e32637f08eb633f065a9e1d7c"
    },
    {
      "path": "skills/systematic-debugging/root-cause-tracing.md",
      "sha256": "a81bee9448794d261b4aca8487c595d11ff4bd4e10a5f96bca1117dd32527050"
    },
    {
      "path": "skills/systematic-debugging/test-academic.md",
      "sha256": "fe2ba480d78ac0d686dc025f41c2a32a43d642bf533f91b0c6053a04d35d6486"
    },
    {
      "path": "skills/systematic-debugging/test-pressure-1.md",
      "sha256": "0b6a915db0054577819834c79be9eb614e97bddba10d73768e1fbe91cfed048a"
    },
    {
      "path": "skills/systematic-debugging/test-pressure-2.md",
      "sha256": "b2030aeffba07050e8ad573ddf87486457c4a016a786bb326235bebd856f2016"
    },
    {
      "path": "skills/systematic-debugging/test-pressure-3.md",
      "sha256": "96b50a52e2c7989c9cf20fb752c47c1e9a3a70dc362f8f7989f8f5b64dac7708"
    },
    {
      "path": "skills/test-driven-development/SKILL.md",